{
  "suite_version": "qa-pilot-epic-scenario-suite-v1",
  "generated_at": "2026-07-24T02:50:51Z",
  "sdk_version": "qa-pilot-evidence-sdk-v1",
  "scenario_id": "EP-EP-001",
  "title": "Complete Evidence Plane Composition",
  "type": "complete_epic",
  "target_epic": "Evidence Plane (OE-001 through OE-006)",
  "overall": "PASS",
  "details": [
    {
      "check_id": "EVIDENCE_AVAILABLE",
      "description": "Evidence is available",
      "expected": true,
      "observed": true,
      "passed": true,
      "detail": "Evidence Plane data is reachable through SDK"
    },
    {
      "check_id": "FINDINGS_EXIST",
      "description": "Finding count in range [1, 100]",
      "expected": "1\u2013100",
      "observed": 13,
      "passed": true,
      "detail": "13 diagnostic findings present"
    },
    {
      "check_id": "COMPOSITION_GRAPH_EXISTS",
      "description": "Graph has >= 1 nodes and >= 0 edges",
      "expected": "nodes>=1, edges>=0",
      "observed": "nodes=13, edges=13",
      "passed": true,
      "detail": "Composition graph: 13 nodes, 13 edges, schema=evidence-composition-graph-v1"
    },
    {
      "check_id": "PROVENANCE_CHAIN_EXISTS",
      "description": "Provenance records >= 1",
      "expected": 1,
      "observed": 18,
      "passed": true,
      "detail": "18 provenance records"
    },
    {
      "check_id": "NO_MUTATION_PATH",
      "description": "All SDK queries have no_mutation_path=True",
      "expected": true,
      "observed": true,
      "passed": true,
      "detail": "Mutation path enforcement verified"
    }
  ],
  "learning_artifact": {
    "scenario_id": "EP-EP-001",
    "title": "Complete Evidence Plane Composition",
    "type": "complete_epic",
    "summary": "PASS",
    "areas_of_attention": [],
    "strengths": [],
    "explanation": "The Evidence Plane is the Librarian's diagnostic system.",
    "teachable_moment": "All checks passed. The system composes correctly."
  },
  "read_only": true,
  "no_authority_conferred": true
}
